,Course Code,Course Name,Course Description,Instructor(s),Terms Offered,Prerequisite(s),Equivalent Courses,Notes
243,SPAN 20310,Chicago Habla Español,"Chicago is known to have multiple, diverse Spanish-speaking communities. In this course, students will use these communities as their classroom to analyze and debate current issues confronting the LatinX experience in the United States and Midwest.  In parallel, class instruction will reinforce and expand students' grammatical and lexical proficiency in a manner that will allow students to engage in real-life activities involving speaking, reading, listening and writing skills. This intermediate-high language course targets the development of writing skills and oral proficiency in Spanish and is designed as an alternative to SPAN 20300.  Students will review problematic grammatical structures, write a number of essays, and participate in multiple class conversations using authentic readings and listening segments as linguistic models on which to base their own production. At the end of class, students are expected to produce an individual project.",Staff,Winter,SPAN 20200 or placement,"LACS 20310, CHST 20310",None
244,SPAN 20401,Gramática avanzada y cultura contemporánea para la argumentación I,"This course is the first segment of the third-year (advanced) Spanish language sequence. It aims to strengthen all four linguistic skills, advanced argumentation, critical thinking and transcultural competence via discussion of press articles, short stories, films, and recorded interviews with native speakers from a variety of regions. Grammatical structures, syntactic patterns and vocabulary known to be problematic for English speakers will be reviewed and practiced. Controversial topics in politics, contemporary culture and modern Spanish and Latin American history will be debated and discussed orally and in writing through a formal debate, several argumentative essays, weekly posts on online discussion boards, class discussions, and summaries of texts and audios assigned. Students will also be asked to formulate well-supported arguments on these topics, and to reflect on similarities and contrasts between their own culture and those of the Spanish-speaking world.",None,Spring Winter,SPAN 20300 or consent of instructor,None,None
245,SPAN 20501,Gramática avanzada y cultura contemporánea para la argumentación II,"This course is the second segment of the third-year (advanced) Spanish language sequence. It aims to strengthen all four linguistic skills, advanced argumentation, critical thinking and transcultural competence via discussion of press articles, short stories, films, and recorded interviews with native speakers from a variety of regions. Grammatical structures, syntactic patterns and vocabulary known to be problematic for English speakers will be reviewed and practiced. Controversial topics in politics, contemporary culture and modern Spanish and Latin American history will be debated and discussed orally and in writing through a formal debate, several argumentative essays, weekly posts on online discussion boards, class discussions, and summaries of texts and audios assigned. Students will also be asked to formulate well-supported arguments on these topics, and to reflect on similarities and contrasts between their own culture and those of the Spanish-speaking world.",None,Spring Winter,SPAN 20400 or consent of instructor,None,This course is the equivalent of SPAN 20500
246,SPAN 20402,Curso de redacción académica para hablantes nativos,"This advanced language course helps students achieve mastery of composition and style through the acquisition of numerous writing techniques. A wide variety of literary and non-literary texts are read. Through writing a number of essays and participating in class discussions, students are guided in the examination of linguistic structures and organization of several types of written Spanish discourse. This course also enhances awareness of the cultural diversity within the contemporary Spanish-speaking world and its historical roots.",Staff,Autumn Spring Winter,SPAN 20302 or placement. Open to native and heritage speakers.,None,None
247,SPAN 20602,Discurso académico para hablantes nativos,"The goal of this advanced conversation course is to help students identify and acquire the mechanisms necessary to engage in academic discourse. Throughout the course, students will participate in debates, lectures, and seminars. In addition, they will conduct a formal interview with a Spanish speaker. The topics of the different activities will be selected by the students according to their specializations at the University, but they will always try to establish a relationship with the Spanish-speaking world. All activities will expose the student to different styles of discourse and academic vocabulary. 
To also encourage spontaneous and informal conversation, six student-led get-togethers will be organized on a variety of topics. At the end of the course, students will know how to express themselves orally following the established academic conventions.""",Staff,Spring Winter,SPAN 20302 or placement. Open only to native and heritage speakers with consent of instructor.,None,None
248,SPAN 21100,Las regiones del español,"This sociolinguistic course expands understanding of the historical development of Spanish and awareness of the great sociocultural diversity within the Spanish-speaking world and its impact on the Spanish language. We emphasize the interrelationship between language and culture as well as ethno-historical transformations within the different regions of the Hispanic world. Special consideration is given to identifying lexical variations and regional expressions exemplifying diverse sociocultural aspects of the Spanish language, and to recognizing phonological differences between dialects. We also examine the impact of indigenous cultures on dialectical aspects. The course includes literary and nonliterary texts, audio-visual materials, and visits by native speakers of a variety of Spanish-speaking regions.",Staff,Autumn Spring,SPAN 20300 or placement,LACS 21100,None
249,SPAN 21101,Basque Culture and Society,"Straddling the border of southern France and northern Spain, the Basque Country is the home of a complex national community without a state -but with a language that is unrelated to any other in the world and is perhaps the most remarkable feature of their cultural identity.  Through the analysis of a wide variety of texts and artifacts, this course will give students the the background to navigate through different dimensions of Basque culture (traditions, gastronomy, music, the language) as well as the history that has marked the development of Basque society (including the so-called Basque Conflict).",None,Winter,None,Taught in English. Prior knowledge of Basque language or culture not required.,"BASQ 21100, GLST 21100"
250,SPAN 21150,El español en los Estados Unidos,"This sociolinguistic course expands understanding of both the historical and the contemporary development of Spanish in parts of the United States, and awareness of the great sociocultural diversity within the Spanish-speaking communities in the United States and its impact on the Spanish language. This course emphasizes the interrelationship between language and culture as well as ethno-historical transformations within the different regions of the United States. Special consideration is given to identifying lexical variations and regional expressions exemplifying diverse sociocultural aspects of the Spanish language, and to recognizing phonological differences between dialects. We also examine the impact of English on dialectical aspects. The course includes sociolinguistic texts, audio-visual materials, and visits by native speakers of a variety of Spanish-speaking regions in the United States.",Staff,Winter,SPAN 20300,LACS 21150,None
251,SPAN 21310,Golden Age Poetry Theory and Practice of Lyric Reading,"In this course we will read a few classic Spanish poems of the Golden Age from different methodological and theoretical paradigms. Each class session will revolve around one or a few poems in order to allow time for in-depth discussion and analysis, and we will often pair these lyric texts with influential critical readings of them. On the one hand, this will provide students with an introduction to the main poetic traditions, themes, and authors of the Spanish Golden Age in their historical context. On the other, we will critically examine a varied array of reading strategies and interpretive paradigms, including structuralism and post-structuralism, philology and textual criticism, Marxism, feminist criticism and gender studies, New Historicism, and emerging scholarship in ""lyric theory."" Moreover, we will engage in a discussion about the value, the meaning, and the social uses of poetry broadly considered.",Miguel Martínez,None,None,Taught in Spanish. Course not offered in 24-25,SPAN 31310
252,SPAN 21500,Introducción al análisis literario,"Through a variety of representative works of Hispanic literature, this course focuses on the discussion and practical application of different approaches to the critical reading of literary texts. We also study basic concepts and problems of literary theory, as well as strategies for research and academic writing in Spanish.",Mario Santana,None,SPAN 20300 or consent of instructor.,None,Taught in Spanish. Course not offered in 24-25
253,SPAN 21610,"Catalan Culture and Society: Art, Music, and Cinema","This course provides an interdisciplinary survey of contemporary Catalonia. We study a wide range of its cultural manifestations (architecture, paintings, music, arts of the body, literature, cinema, gastronomy). Attention is also paid to some sociolinguistic issues, such as the coexistence of Catalan and Spanish, and the standardization of Catalan.",Bel Olid,Spring,None,The course will be conducted in English.,"GLST 21601, CATA 21600"
254,SPAN 21703,Introducción a las literaturas hispánicas: textos españoles clásicos,"This course involves careful reading and discussion of significant works from the Spanish Middle Ages, Renaissance, and the Golden Age, including Juan Manuel's Conde Lucanor, Jorge Manrique's Coplas, the anonymous Lazarillo de Tormes, and the theater of Calderón.",None,None,SPAN 20300 or consent of instructor.,Taught in Spanish. Course not offered in 24-25,MDVL 21703
255,SPAN 21705,Iberian Literatures and Cultures: Medieval and Early Modern,"This course explores Spanish language, literature, and culture focusing on premodern Iberian texts and artifacts. We will start by anonymous ""Cantar de Mio Cid,"" the first great vernacular epic in the Middle Ages, and we will end in Maria de Zayas's ""Novelas ejemplares,"" one of the finest expressions of European early modern short story. Between these two literary works we will talk about music, painting, witchcraft, conversion, and the Inquisition as milestones of a five-century span. In this time Spanish consolidates as a written language, while numerous political and religious conflicts mark the struggle for hegemony in the Iberian Peninsula. In addition to enhancing your knowledge of Iberian cultural history and improving your close reading and critical thinking skills, this course is designed to continue building on your linguistic competence in Spanish.",Noel Blanco Mourelle,Winter,SPAN 20300 or consent of instructor.,Taught in Spanish. This course is the equivalent of SPAN 21703.,MDVL 21705
256,SPAN 21803,Introducción a las literaturas hispánicas: textos españoles contemporáneos,"Este curso ofrecerá un amplio panorama de las literaturas españolas de los siglos XIX y XX. Buena parte de la historia cultural de España ha estado marcada por la ansiedad respecto al supuesto atraso cultural, político, social y económico del país. La modernidad se convierte así en objeto de deseo y de disputa cultural para los intelectuales españoles que luchan por definir en qué consiste y cómo alcanzarla. Este es el tema que nos guiará, de manera flexible, por las obras de autores como Mariano José de Larra, Gustavo Adolfo Bécquer, Rosalía de Castro, Emilia Pardo Bazán, Leopoldo Alas Clarín, Antonio Machado, Federico García Lorca, Ana María Matute, Max Aub y Manuel Rivas, entre otros, complementadas por algunas películas. En relación con este tema principal, se explorarán también el lugar del campo y la ciudad en la imaginación moderna, la cuestión nacional, las luchas por la emancipación de la mujer, las tensión creativa entre tradición y vanguardia artística, o los debates sobre la historia y la memoria del pasado reciente de España.",None,None,SPAN 20300 or consent of instructor.,None,Taught in Spanish. Course not offered in 24-25
257,SPAN 21805,Iberian Literatures and Cultures: Modern and Contemporary,"This is a survey of the literatures and cultures of Spain from the 19th to the 21st centuries. The course offers an introduction to key historical moments of Spanish modernity, including the age of liberalism and the end of the empire, the Civil War and the Spanish exile, and the fight for democracy and equality in the Transition period and in the present day. Through literature, film, and the visual arts we will discuss topics such as the rivalry of competing national projects, the creative tension between tradition and avant-garde, the relationship between languages, literature, and society, and the struggles of women, among others. We will study towering cultural figures such as Emilia Pardo Bazán, Federico García Lorca, Mercè Rodoreda, Pablo Picasso, or Luis Buñuel, among many others. In addition to enhancing your knowledge of Iberian cultural history and improving your close reading and critical thinking skills, this course is designed to continue building on your linguistic competence in Spanish.",Miguel Martínez,Spring,SPAN 20300 or consent of instructor.,None,Taught in Spanish. This course is the equivalent of SPAN 21803.
258,SPAN 21903,Intro a las lit hispánicas: textos hispanoamericanos desde la colonia a la independencia,"This course examines an array of representative texts written in Spanish America from the colonial period to the late nineteenth century, underscoring not only their aesthetic qualities but also the historical conditions that made their production possible. Among authors studied are Christopher Columbus, Hernán Cortés, Sor Juana Inés de la Cruz, Simón Bolívar, and José Martí.",None,None,SPAN 20300 or consent of instructor.,Taught in Spanish. Course not offered in 24-25,"LACS 21903, CRES 21903"
259,SPAN 21905,Latin American Literatures and Cultures: Colonial and 19th-Century,"This course introduces students to the writing produced in Hispanic and Portuguese America during the period marked by the early processes of European colonization in the sixteenth century through the revolutionary movements that, in the nineteenth century, led to the establishment of independent nation-states across the continent. The assigned texts relate to the first encounters between Indigenous, Black, and European populations in the region, to the emergence of distinct (""New World"") notions of cultural identity (along with the invention of new racial categories), and to the disputes over the meaning of nationhood that characterized the anti-colonial struggles for independence. Issues covered in this survey include the idea of texts as spaces of cultural and political conflict; the relationships between Christianization, secularization, and practices of racialization; the transatlantic slave trade; the uses of the colonial past in early nationalist projects; and the aesthetic languages through which this production was partly articulated (such as the Barroco de Indias, or ""New World baroque,"" Neoclassicism, Romanticism, and Modernismo, among others). In addition to enhancing your knowledge of Latin American cultural history and improving your close reading and critical thinking skills, this course is designed to continue building on your linguistic competence in Spanish.","Larissa Brewer-Garcia, Carlos Halaburda",Autumn Spring,SPAN 20300 or consent of instructor.,Taught in Spanish. This course is the equivalent of SPAN 21903.,"CRES 21950, LACS 21900"
260,SPAN 21910,Contemporary Catalan Literature,"This course provides a survey of major authors, works, and trends in Catalan literature from the beginning of the twentieth century to the present. We study works representing various literary genres (novel, poetry, short story) and analyze the most important cultural debates of the period.",Staff,None,None,"This course will be conducted in English and/or Catalan, depending on the students' command of the language.","CATA 21900, SPAN 31910, CATA 31900"
261,SPAN 21950,"Dark Stairways of Desire"": Lusting beyond the Norm in Contemporary Catalan Literature","Although we can find a significant number of authors exploring queer desire and identities throughout the history of Catalan Literature (from lesbian scenes in Joanot Martorell's ""Tirant lo blanc"" to expanding gender identities in Maria Aurèlia Capmany's ""Quim/Quima""), more recent Catalan Literature is blooming with queerness and non-normative lust. This course will give an overview of contemporary Catalan works influenced by feminist and queer debates from the seventies on. Beginning with renowned poet Maria Mercè Marçal's only novel, ""The Passion According to Rennée Vivien,"" winner of several of the most prestigious literary awards for Catalan Literature, we will go on to discover 21st-century works by Eva Baltasar and Anna Punsoda. We will also read poems, short stories and excerpts from authors such as Maria Sevilla, Mireia Calafell, Raquel Santanera, Sebastià Portell, Sil Bel and Ian Bermúdez, among others.",Bel Olid,Winter,None,Taught in English.,"GNSE 23150, GLST 21950, CATA 21950"
262,SPAN 22003,Introducción a las literaturas hispánicas: del modernismo al presente,"Students in this course study an array of texts written in Spanish America from the late nineteenth century to the present, including the literature of the Hispanic diasporas. Authors may include José Martí, Rubén Darío, Mariano Azuela, Pablo Neruda, César Vallejo, Teresa de la Parra, Jorge Luis Borges, Octavio Paz, Rosario Castellanos, Mario Vargas Llosa, and Pedro Pietri.",None,None,SPAN 20300 or consent of instructor.,Taught in Spanish. Course not offered in 24-25,LACS 22003
263,SPAN 22005,Latin American Literatures and Cultures: 20th and 21st Centuries,"This course will survey some of the main literary and cultural tendencies in Latin America from the beginning of the twentieth century to the present. We will pay special attention to their aesthetic dimensions, as well as the socio-historical and political conditions that made them possible, and in which they simultaneously intervened. Questions to be studied might include the innovations of the Modernist and avant-garde movements, fantastic literature, the novel of the so-called ""Boom,"" cultural production associated with revolutionary movements, military dictatorships, and the Cold War, as well as new currents in literary and theatrical practices. Likewise, the course will foreground some of the following concepts relevant to the study of this production: modernity and modernization; development and neoliberalism; neo-colonialism and empire; cultural autonomy and ideas of poetic and cultural renewal; the epic vs. the novel; realism and non-verisimilitude; and performativity, among others. In addition to enhancing your knowledge of Latin American cultural history and improving your close reading and critical thinking skills, this course is designed to continue building on your linguistic competence in Spanish.","Agnes Lugo-Ortiz, Danielle Roper",Autumn Winter,SPAN 20300 or consent of instructor.,Taught in Spanish. This course is the equivalent of SPAN 22003.,"LACS 22005, CRES 21955"
264,SPAN 22266,Witchcraft and the Cultural Imagination,"This seminar takes as its focal point the vast range of conceptual, material, and visual artifacts that are produced by, and indeed help to construct, this enduring fascination with the figure of the witch, from the medieval past to the present. We will examine case studies from premodern Europe to Colonial North America to Indonesia, scrutinizing texts, films, and works of art. Rather than offering a standard history of witchcraft, we will explore the intersections of gender, labor, and representation that the figure of the witch makes specially available for study. Witchcraft constitutes a multifaceted phenomenon that aims to alter reality and the self through the use of various techniques, transmitted both orally and in writing. These techniques have often appeared culturally marked in terms of gender and belief. Witchcraft has for centuries been the business of women in societies where very few avenues existed for women to develop any sort of business.","T. Golan, N. Mourelle",Winter,None,Students must attend first class to confirm enrollment.,"ARTH 22266, ARTH 32266, GNSE 22288, GNSE 32288, SPAN 32266"
265,SPAN 22324,Empire and Nation in Modern Spain,"This course examines the relationship between cultural products and imperialism in 19th- and 20th-century Spain. We will follow the historical development of Spanish imperialism during that period and how it interacted with the contours of modernity, Spanish identity, and nation-building projects. Through studying texts and cultural products, including visual art and film, we will examine how writers, artists, and scholars represented and debated the multiple Spanish imperial practices in places such as Morocco, the Dominican Republic, and Equatorial Guinea. We will also analyze some responses to the loss of the last Spanish colonies -Cuba, Puerto Rico, and the Philippines- and Franco's involvement in imperial practices. Other topics we will address are the intersection of race and gender in colonized spaces; the construction of otherness; the colonial body; the connections between culture, empire, and science; and Spain's internal diversity and political struggles. Some of the authors we will study include Aurora Bertrana, Benito Pérez Galdós, Emilia Pardo Bazán, Pedro Antonio de Alarcón, Carmen de Burgos, Mariano Fortuny, among others.",Miriam Borerro Robledo,None,None,None,"Course readings, instruction, and discussion will be in Spanish. Course not offered in 24-25"
266,SPAN 22350,Speaking Truth to Power in Medieval Iberia,"In the multilingual and multireligious environment of the Iberian middle ages, poetry can express many things. And while literary history has granted a prestigious space to some of these things, such as love or spirituality, it has consistently neglected others, such as socio-political satire or vulgarity. This class will be paying attention to that other less talked-about poetry that gets into the political struggles of the period, that talks in profanities about profane things. In other words, the poetry that does not speak to the eternity of existence, but that gets its hands dirty with earthly matters. The poetry that savagely mocks and cuts through social conventions in a way that makes seem contemporary Twitter trolls benevolent in comparison. For this class we will be reading authors who wrote in Galician-Portuguese such as Joao Soares de Paiva or King Alfonso X, authors who wrote in Catalan such as Guillem de Bergueda or Ramon Vidal de Besalu, and authors who wrote in Spanish such as Juan Ruiz or Juan de Mena. Translations to Spanish will be provided or worked though class discussion.",N. Blanco Mourelle,None,None,Course not offered in 24-25,"MDVL 22350, CATA 22350, CATA 32350, PORT 22350, PORT 32350, SPAN 32350"
267,SPAN 22423,Gender and Sexuality in Early Modern Spain,"How did men and women understand their roles in early modern Spanish society as dictated by their gender? Could individuals challenge, or even transgress, the societal-and, therefore, gendered-norms by which they were bound? How were the ideals of femininity and masculinity constructed in artistic and literary production? To what extent were gender and sexuality fixed or fluid in the early modern imaginary? These are but a few of the questions that will be addressed in this course, as we examine the complexities and nuances of gender and sexuality in sixteenth- and seventeenth-century Spanish culture. We will engage primarily with literary sources, such as poetry, narrative, theatrical works, and autobiographical writings from key literary figures (Garcilaso de la Vega, Teresa de Ávila, María de Zayas, Lope de Vega, to name a few). Moreover, we will examine visual art as well as medical and moral treatises in order to gain as comprehensive as possible an understanding of the notion of gender and sexuality during this time period. 
In addition to expanding their knowledge of Spanish literature and culture, this course will allow students to continue enhancing their Spanish linguistic competence.",Lizette Arellano,None,None,Taught in Spanish. Course not offered in 24-25,GNSE 22423
