,Course Code,Course Name,Course Description,Instructor(s),Terms Offered,Prerequisite(s),Equivalent Courses,Notes
91,FREN 25900,The People v The State: French Insurrections,"Pourquoi les peuples se soulèvent-ils contre l'Etat ? Quelle fin peut justifier l'insurrection comme moyen ? Qu'elles soient soudaines ou qu'elles germinent pendant des décennies, les insurrections peuvent être le seul moyen de changer les choses, particulièrement dans une démocratie. Parfois on ne s'en rend compte que des semaines ou des mois après l'événement lui-même. Les Français ont une réputation particulière pour les manifestations, les grêves, les barricades : est-ce à cause d'une tradition insurrectionnelle, ou s'agit-il simplement d'un stéréotype ? Dans ce cours, nous étudierons plusieurs insurrections dans l'histoire française et francophone. Nous lirons des textes littéraires et philosophiques de la première modernité à nos jours afin de mieux se représenter les complexités de tels moments, et de discuter les approches théoriques aux concepts socio-politiques d'insurrection, de révolution, violence, guerrilla, etc. La classe sera centrée sur l'idée de réagir au passé afin de trouver des réponses pour le présent ; pour cela, les étudiants seront immergés pendant cinq semaines dans un jeu de rôle historique où la classe deviendra l'Assemblée Nationale Constituante de 1791. Ils rechercheront, prépareront et joueront les rôles de députés conservateurs, Jacobins, Louis XVI, Lafayette, ou seront chefs révolutionnaires des sections de Paris, comme Danton.",Pauline Goul,Course not offered in 24-25.,"FREN 20500, 20503 or a literature course taught in French.",None,Taught in French.
92,FREN 25910,Racine,"Racine's tragedies are often considered the culminating achievement of French classicism. Most famous for his powerful re-imaginings of Greek myth (Phèdre, Andromaque), his tragic universe nevertheless ranged considerably wider, from ancient Jewish queens to a contemporary Ottoman harem. We will consider the roots (from Euripides to Corneille) of his theatrical practice as well as its immense influence on future writers (from Voltaire to Proust, Beckett, and Genet).",L. Norman,Autumn,"At least one French literature course, 21700 or higher.",Course taught in French. All work in French for students seeking FREN credit; written work may be in English for those taking course for TAPS or FNDL credit.,"TAPS 35910, FREN 35910, FNDL 25910, TAPS 28476"
93,FREN 26003,Introduction à l'autobiographie,"This course traces the history of the autobiographical genre in France from the eighteenth century to the present. The study of key texts will be accompanied by an introduction to some critical perspectives. We will give special emphasis to questions of reference and authenticity, identity and subject formation, and gender and the family. Authors include Rousseau, Chateaubriand, Stendhal, Colette, Perec, and Sarraute.",A. James,Course not offered in 24-25.,FREN 20500 or 20503,Taught in French. This is an introductory-level course.,GNSE 26003
94,FREN 26012,Introduction au théâtre maghrébin,"Ce cours offre un aperçu de l'évolution de l'art dramatique au Maroc, en Algérie et en Tunisie en examinant des questions telles que l'apport des formes populaires, l'emprunt aux textes étrangers, et le lien entre l'écriture théâtrale et des débats d'ordre social, culturel ou politique. On analysera en particulier les formes d'écriture, de mise en scène et de performance pratiquées par les dramaturges maghrébins et la manière dont leurs créations permettent de repenser les cultures et les mémoires nationales, le rapport entre le théâtre et l'histoire ainsi que la représentation des identités maghrébines et de leur dialogue avec l'étranger. Les dramaturges étudiés comprennent Tayeb Saddiki, Driss Ksikes, Kateb Yacine, Aziz Chouaki, Jalila Baccar, Fadhel Jaïbi.",Khalid Lyamlahy,Course not offered in 24-25.,FREN 20500 or 20503,Taught in French. All work in French for students seeking FREN credit; written work may be in English for those taking the course for TAPS credit. This is an introductory-level course.,TAPS 24612
95,FREN 26043,"Versailles: Art, Power, Resistance and the Sun King's Palace","Louis XIV's Palace of Versailles helped shape European culture and history from the Baroque era through the French Revolution, and it continues to animate contemporary international culture. How does this astounding assemblage of architecture, visual arts, landscaping, performance spaces and political arenas reveal transformations in cultural tastes and power arrangements over the centuries? How do literature and art alternately support and subvert absolutist power and state propaganda? To respond we will range across media, from the bitingly satiric comedies and provocative tragedies of the seventeenth century (Molière, Racine), through royal edicts regulating colonial slavery and first-hand accounts of the 1789 Women's March on Versailles that upended the monarchy, and finally to cinematic depictions (from Jean Renoir to Sophia Coppola) and experimental palace installations by the world's leading contemporary artists (Jeff Koons, Anish Kapoor, etc.). While this course will broadly introduce major themes of French and European culture and history of the early-modern and modern periods, students are also encouraged to pursue in-depth projects in their own areas of interest, from history and political philosophy to the visual arts, theater and performance, and literature.",L. Norman,Course not offered in 24-25.,"Students who register under FREN 26043 must have completed FREN 20300 or equivalent, and will read French texts in the original.","Class conducted in English, with French discussion sessions and reading and writing in French for students registered under FREN 26043.",SIGN 26043
96,FREN 26220,Classicism and Romanticism,"This undergraduate/graduate course will examine the dynamic relationship between the French ""Classicism"" of the Age of Louis XIV and the later post-Revolutionary movement of Romanticism. We will pair readings of poetic, dramatic, and narrative works from the 17th century (e.g., Molière, Mme de La Fayette, Corneille, Racine) with later counterparts (Germaine de Staël, Chateaubriand, Stendhal, Hugo, George Sand), probing changing conceptions of the role of literature and art, as well as shifting attitudes towards erotic love, social norms, and nature.",L. Norman,Course not offered in 24-25.,FREN 20500 and one introductory-level literature course taught in French.,Taught in French.,FREN 36220
97,FREN 26300,Women in French Literature,TBD,None,Course not offered in 24-25.,None,"FREN 36301, GNSE 26301",None
98,FREN 26333,La poésie maghrébine d'expression française,"Depuis son émergence vers le milieu des années 1930, la poésie maghrébine d'expression française a accompagné les bouleversements politiques dans les trois pays du Maghreb et influencé la production romanesque des écrivains maghrébins. Dans les années 1960, des expériences collectives majeures - telles que la revue Souffles au Maroc - placent la poésie au centre du projet de renouvellement culturel dans la région. A la suite de ces dynamiques de groupes, les poètes maghrébins développent des œuvres poétiques ancrées dans leurs expériences individuelles mais désormais ouvertes sur le monde. Des thématiques récurrentes telles que l'exil, l'errance, le désir de révolte et la quête de la liberté mobilisent des techniques poétiques aussi variées que la violence linguistique, le dialogue avec les mythes ou encore l'utilisation des ressources de l'oralité. En étudiant un corpus d'œuvres poétiques choisies du Maroc (Abdellatif Laâbi, Tahar Ben Jellou, Rachida Madani, Saïda Menebhi), de l'Algérie (Jean Sénac, Kateb Yacine, Assia Djebar) et de la Tunisie (Albert Memmi, Amina Saïd, Tahar Bekri), ce cours présente une introduction générale à la poésie maghrébine d'expression française. On analysera en particulier les formes, les procédés et les motifs poétiques permettant d'appréhender la figure du poète, sa représentation de la patrie, son discours politique ou encore son univers de représentations sensorielles et symboliques.",K. Lyamlahy,Spring,FREN 20500 or 20503 for undergraduates.,Taught in French.,FREN 36333
99,FREN 26510,Oulipo in Context,TBD,None,Course not offered in 24-25.,None,"CMLT 36510, FREN 36510, CMLT 26510",None
100,FREN 26680,Literary Games: Oulipo and Onward,"Does constraint foster creativity? Can wordplay carry political meaning? Is formal innovation divorced from lyrical expression? How do experimental literary movements respond to their sociopolitical moments and local contexts, and how do they transform when they travel across geographical and linguistic borders? We will consider these questions via the work of the longest-lived French literary group, the Oulipo (Ouvroir de littérature potentielle or Workshop for Potential Literature), examining its origins as a quasi-secret society in 1960 and its expansion into an internationally visible and multilingual collective (with members from Italy, Spain, Argentina, and the US). We will investigate debates about inspiration and authorship, copying and plagiarism, collective creation, multilingualism, constraint and translation, and the viability of the lyric subject. While considering antecedents (Edgar Allan Poe, Raymond Roussel), our readings will explore several generations of Oulipians (Raymond Queneau, Georges Perec, Italo Calvino, Michèle Métail, Anne Garréta, Frédéric Forte), and conclude with some very contemporary Oulipo-inspired writing from around the world (Christian Bök, Urayoán Noel, Mónica de la Torre, K. Silem Mohammed). Alongside critical essays, students will carry out short experiments with constraint and procedure, as well as translation exercises; and they will have the opportunity for dialogue with acclaimed writers and scholars who will visit our seminar.",Rachel Galvin and Alison James,Spring,Open to advanced undergraduates. Students who are taking the class for French credit will complete some readings and writings in French.,FREN 36680,None
101,FREN 26700,"Jeanne d'Arc, histoire et legende","S'appuyant sur l'exemple de Jeanne d'Arc, ce cours s'intéressera à la manière dont nous transformons le passé à la lumière des besoins et des soucis du présent. Nous situerons Jeanne d'Arc dans son contexte historique à l'aide des documents légaux, littéraires, et ecclésiastiques. Nous considérerons ensuite les représentations multiples et variées de Jeanne au cours des siècles suivants, examinant par exemple des textes de Voltaire, de Michelet, d'Anouilh, et d'autres, ainsi que des films qui présentent la vie de Jeanne d'Arc.",Daisy Delogu,Course not offered in 24-25.,"FREN 20500, 20503 or a literature course taught in French.",Taught in French.,"MDVL 26700, GNSE 26700"
102,FREN 26770,Stories of Oceans and Archipelagos,"According to Fijian-Tongan writer Epeli Hau'ofa, ""There is a world of difference between viewing the Pacific as 'islands in a far sea' and as 'a sea of islands.'"" In this course, we will delve into the ""world of difference"" that exists between viewing islands as remote and insignificant, and considering them as crucial nodes in an ever-expanding planetary network. Simultaneously, we will consider the stakes of moving away from traditional representations of the ocean as a blank canvas for human movement, to instead consider it as a vibrant material and multispecies space. This course will encourage students to formulate their own approaches to cutting-edge debates in archipelagic theory and critical ocean studies, and to situate those debates within the broader fields of environmental humanities and postcolonial studies. Readings will be drawn from the Pacific Ocean, the Atlantic Ocean (including the Caribbean Sea), and the Indian Ocean.",Nikhita Obeegadoo,Spring,"For students seeking French credit, FREN 20500 or equivalent.",None,Taught in French.
103,FREN 27400,Autobiographies Maghrébines: de l'Ecriture de Soi à l'Ecriture de l'Histoire,"Dès sa naissance, la littérature maghrébine d'expression française s'est distinguée par son ancrage dans le contexte historique, politique et socio-culturel des trois pays du Maghreb que sont le Maroc, l'Algérie et la Tunisie. Souvent, l'écriture de soi a donné lieu à une (ré)écriture de l'Histoire, mettant l'individuel et le collectif en dialogue permanent. L'autobiographie, par exemple, devient le champ d'une exploration simultanée des identités individuelle et collective, le lieu d'un témoignage littéraire autour de l'expérience coloniale et de ses conséquences, ou encore de la confrontation entre le poids persistant de la tradition et le désir de liberté et de changement. En se racontant, l'écrivain maghrébin restitue les tensions qui hantent l'espace et la mémoire partagés tout en proposant des voies de reconstruction à travers la révolte, le désir, et le travail de la langue. En s'appuyant sur un corpus d'œuvres marquantes de la littérature maghrébine d'expression française (Albert Memmi, Driss Chraïbi, Kateb Yacine, Assia Djebar, Fatima Mernissi, Abdellatif Laâbi), ce séminaire sera consacré essentiellement à la question du rapport entre écriture personnelle et écriture de l'Histoire dans un contexte maghrébin. On s'interrogera en particulier sur les stratégies narratives et les outils esthétiques mis en œuvre par les auteurs maghrébins pour représenter, affronter ou déconstruire une réalité d'ordre historique, politique ou socio-culturel.",K. Lyamlahy,Course not offered in 24-25.,FREN 20500 or 20503,None,Taught in French.
104,FREN 27600,Ancien Francais/Old French,"This course will introduce students to the phonetics, morphology, syntax, and vocabulary of Old French in order to equip them with the skills necessary to work with Old and Middle French texts. We will examine and translate verse and prose passages from the twelfth to fifteenth centuries, discussing also their literary and historical contexts. The course will be conducted, as a practicum, in English.",D. Delogu,Course not offered in 24-25.,None,"Knowledge of Latin and/or modern French, though obviously helpful, is not required.",FREN 37600
105,FREN 27601,Debats et querelles litteraires au Moyen Age,TBD,None,Course not offered in 24-25.,None,None,None
106,FREN 27770,Existentialism and Its Literary Legacies,"More than a school of philosophical thought, existentialism was an intellectual movement that dominated French culture in the years following World War II. This course focuses on the literary legacy of existentialism, considering postwar debates over littérature engagée, the intersections of existentialism and the nouveau roman, and the importance of feminist existentialism for women writers. Why did existentialist thinkers turn to forms of literary expression, writing plays and novels? How did they shape the reception of other writers, and how did later writers revisit existentialist concerns? Readings may include texts by Jean-Paul Sartre, Albert Camus, Gabriel Marcel, Simone de Beauvoir, Nathalie Sarraute, Monique Wittig, Georges Perec, and Annie Ernaux.",A. James,Course not offered in 24-25.,FREN 20500 or 20503 for undergraduates.,Readings and discussion section in French.,FREN 37770
107,FREN 28000,The Theatrical Illusion:,TBD,None,Course not offered in 24-25.,None,"FREN 38000, CMLT 31001, REMS 38000, TAPS 28463, CMLT 21001",None
108,FREN 28102,Regendering the Medieval Body Politic,TBD,None,Course not offered in 24-25.,None,"FREN 38102, GNSE 38103, GNSE 28103",None
109,FREN 28110,"Le Roman Medieval, XIIe-XVe siecles",TBD,None,Course not offered in 24-25.,None,FREN 38110,None
110,FREN 28301,La Comedie Classique,TBD,None,Course not offered in 24-25.,None,FREN 38301,None
111,FREN 28410,Ecrire le « Printemps arabe » au Maghreb : témoignages et perspectives littéraires,"Fin 2010, l'immolation de Mohamed Bouazizi, un vendeur ambulant tunisien, déclenche un soulèvement populaire qui s'étend rapidement au reste du monde arabe, entraînant notamment la chute des régimes en Tunisie et en Egypte et une série de reconfigurations d'ordre politique et socio-économique. Si les pays du Maghreb ont vécu ces soulèvements et leurs conséquences de manières différentes, les écrivains maghrébins ont été particulièrement sensibles à l'élan et à la promesse de changement portés par la rue. Ceci étant, et à l'image de l'appellation « Printemps arabe », à la fois utilisée et récusée, les dynamiques et les résultats des protestations ont fait l'objet de nombreux débats. En s'appuyant sur ce contexte historique, ce cours s'intéresse aux différentes modalités d'écriture des soulèvements au Maghreb à travers divers genres littéraires, du témoignage à la fiction, en passant par l'essai, le théâtre ou encore la poésie. En étudiant un corpus de textes francophones issus de la Tunisie (Meddeb, Filali, Bekri), de l'Algérie (Benfodil, Boudjedra, Tamzali, Sebbar) et du Maroc (Ben Jelloun, Elalamy, Terrab), nous nous intéresserons à la représentation de la révolte populaire dans ses dimensions socio-politique et culturelle mais aussi à des questions clés telles que les formes d'engagement des écrivains, leurs approches et choix esthétiques et le rapport entre la dynamique des soulèvements et la construction narrative ou poétique des textes.",K. Lyamlahy,Course not offered in 24-25.,FREN 20500 or 20503,Readings and discussions in French.,FREN 38410
112,FREN 28900,La Princesse de Clèves and the Genesis of the Modern Novel,"Madame de La Fayette's 1678 novel represents a turning point in the international development of the psychological novel and historical fiction. Set in a Renaissance past of courtly international intrigue, the novel plumbs its characters' interiorized struggles with erotic desire, marriage, and adultery, forging a path for later novelists such as Flaubert, George Eliot, and Tolstoy. We will examine debates about its literary form and moral impact, as well as around gender and women's writing, placing the novel in a transnational context (Spanish, Italian, and English romances, drama, and moral philosophy) and its later reception, including film adaptations and its role in heated contemporary controversies around the place of the humanities in society. Students are encouraged to undertake individual comparative research projects in relation to the novel. Course taught in English but reading ability in French required. All work in French for students seeking FREN credit; written work may be in English for those taking course for CMLT, SCTH, or FNDL credit.",Larry Norman,Winter,"Consent of instructor required for undergrads; those seeking FREN credit must have completed at least one French literature course, 21700 or higher.",FREN 38900,None
113,FREN 29301,Language Identity and Power in French-Creolophone Contexts,"This course examines the concept of language identity (i.e., the language[s] people employ to represent themselves) in multilingual Creolophone communities, particularly in Haiti. This course also examines the relationships between language identity, learning, language use, and literacy development in these societies. By the end of the course, students will be able to explain: 1) what language identity in multilingual Creolophone community reveal about speakers and their language attitudes; 2) how context and mode of communication can impact language identity and language use; 3) literacy acquisition and achievement in Creole communities; and 4) how Creolophones' learning and literacy development are affected by language policies and ideologies. A final project will require students to design and conduct a preliminary sociolinguistic study based on students' interests in the French-Creolophone world.",Gerdine Ulysse,Spring,"Knowledge of French and Kreyòl will be helpful, but not required.",Taught in English.,"LACS 29299, KREY 29300"
114,FREN 29401,Georges Perec Et L'Oulipo,TBD,None,Course not offered in 24-25.,None,FREN 39401,None
115,FREN 29700,Readings in Special Topics,This course is a study of directed readings in special topics not covered by courses offered as part of the program in French. Subjects treated and work completed for the course must be chosen in consultation with the instructor no later than the end of the preceding quarter.,None,None,"FREN 10300 or 20300, depending upon the requirements of the program for which credit is sought",None,Students are required to submit the College Reading and Research Course Form.
116,FREN 29900,BA Paper Preparation: French,"In consultation with a faculty member, students devote the equivalent of a one-quarter course to the preparation of a BA project.",None,None,Consent of undergraduate adviser,None,Students are required to submit the College Reading and Research Course Form. Must be taken for a quality grade. Counts towards course requirements for French majors seeking honors.
117,FREN 29901,Academic Research and Writing,TBD,Staff,None,None,None,None
118,FREN 37000,Neoclassical Aesthetics: Transnational Approaches,"Though ""aesthetic"" philosophy first developed as an autonomous field in the mid-eighteenth century, it has important roots in earlier eighteenth- and seventeenth-century debates concerning literature and the arts. In the wake of Cartesian rationalism, could reasoned method be reconciled with non-rational creativity, or decorous order with the unruly ""sublime""? Just what kind of ""truth"" was revealed by poetry or painting? What is the value of the Greco-Roman models versus authorial innovation? We will consider the relation between literature and other media (particularly opera and the visual arts) and read French texts in dialogue with other, and often contending, national trends (British, German, Italian). Readings will include Descartes, Pascal, Perrault, Félibien, Dryden, Du Bos, Addison, Vico, Montesquieu, Staël, and A.W. Schlegel.",Larry Norman,Winter,Reading knowledge of French is required. Undergrads permitted with consent of instructor.,Taught in English. Students seeking FREN credit must complete all readings and written work in French.,"ARTH 48301, SCTH 37000, CMLT 38600"
119,ITAL 10100,Beginning Elementary Italian I,"This course is the first of a three-part language sequence that provides beginning students with a solid foundation in the language and the cultural norms necessary for everyday communication in Italy. It is designed to help students obtain functional competency in speaking, writing, reading, and listening. Students will practice all three modes of communication (interpersonal, interpretive, and presentational). They will also explore aspects of Italian culture, traditions, and regions through a selection of texts and audio-visual materials that aim to raise cultural awareness and encourage intercultural reflection.",Staff,Autumn,None,None,None
120,ITAL 10200,Beginning Elementary Italian II,"This course offers a rapid review of the basic patterns of the language presented in ITAL 10100 and further explores the language and the cultural norms necessary for everyday communication in Italy. It is designed to help students obtain functional competency in speaking, writing, reading, and listening with a focus on present and past time frames. Students will practice all three modes of communication (interpersonal, interpretive, and presentational). They will also explore aspects of Italian culture, traditions, and regions through a selection of texts and audio-visual materials that aim to raise cultural awareness and encourage intercultural reflection.",Staff,Winter,ITAL 10100 or placement,None,None
121,ITAL 10300,Beginning Elementary Italian III,"This course is the third of a three-part language sequence that provides a solid foundation in the language and the cultural norms necessary for everyday communication in Italy. It expands on the language presented in previous parts of the sequence, and provides functional competency in speaking, writing, reading, and listening, with a focus on present, past and future time frames. Students will practice all three modes of communication (interpersonal, interpretive, and presentational). They will also explore aspects of Italian culture, traditions, and regions through a selection of texts and audio-visual materials that aim to raise cultural awareness and encourage intercultural communication. Successful completion of ITAL 10300 meets the language competence requirement.",Staff,Spring,ITAL 10200 or placement,None,None
122,ITAL 12200,Italian for Speakers of Romance Languages,This course is intended for speakers of other Romance languages to quickly develop competence in spoken and written Italian. Students learn ways to apply their skills in another Romance language to Italian by concentrating on the similarities and differences between languages. Students with a placement of 20100 or higher in any of the other Romance Languages are eligible to take ITAL 12200 for completion of the College Language Competency Requirement.,Staff,Spring Winter,20100 in another Romance language or consent of instructor.,None,None
