,Course Code,Course Name,Course Description,Instructor(s),Terms Offered,Prerequisite(s),Equivalent Courses,Notes
183,ITAL 26204,Italian Renaissance Humanism,TBD,None,None,None,Course not offered in 24-25.,ITAL 36204
184,ITAL 26210,The World in Ruins,"In this course we will not limit ourselves to the traditional view of 'ruins' as remains of ancient or modern buildings. Our course will involve a variety of different artifacts (literary texts, paintings, films, philosophical tracts, etc.) from different cultural moments, in order to attain a clearer understanding of our notion of ruins, decay, and decadence. We will first examine 'ruins' in classical cultures, focusing on Plutarch's short treatise On the Obsolescence of Oracles. We will investigate the 'discovery' of ruins in the Renaissance through Petrarch's Letters on Familiar Matters, his canzoniere, and his epic poem Africa, Francesco Colonna's verbal/visual Hypnerotomachia Poliphili (The Strife of Love in a Dream), and Joaquim De Bellay's The Antiquities of Rome. 17th-century approach to ruins and decay will focus on Benjamin's texts (Origins of the German Tragic Drama among others), Agamben's response to Benjamin in Man Without Content, and European poetry and paintings. After an analysis of Piranesi's famous etchings Vedute di Roma, we will approach Romanticism through Leopardi's and Hölderlin's works. There will be a screening of Pasolini's The Walls of Sana'a (1970), which will open our discussion of the concepts of decay and annihilation in modern times. We will read Curzio Malaparte's novel The Skin and W. G. Sebald's On the Natural History of Destruction, César Aira's Episode in the Life of a Landscape Painter, and the recent Anthropocene: The Human Epoch.",A. Maggi,None,None,Taught in English. Course not offered in 24-25.,"CMLT 26211, ITAL 36210, CMLT 42311"
185,ITAL 26401,Torquato Tasso,"This course investigates the entire corpus of Torquato Tasso, the major Italian poet of the second half of the sixteenth century. We read in detail the ""Gerusalemme Liberata"" and ""Aminta,"" his two most famous works, in the context of their specific literary genre. We then spend some time examining the intricacies of his vast collection of lyric poetry, including passages from his poem ""Il mondo creato."" We also consider some of his dialogues in prose that address essential issues of Renaissance culture, such as the theories of love, emblematic expression, and the meaning of friendship.",A. Maggi,None,None,Taught in Italian. Course not offered in 24-25.,"FNDL 26401, ITAL 36401"
186,ITAL 26500,Renaissance Demonology,"In this course we analyze the complex concept of demonology according to early modern European culture from a theological, historical, philosophical, and literary point of view. The term 'demon' in the Renaissance encompasses a vast variety of meanings. Demons are hybrids. They are both the Christian devils, but also synonyms for classical deities, and Neo-platonic spiritual beings. As far as Christian theology is concerned, we read selections from Augustine's and Thomas Aquinas's treatises, some complex exorcisms written in Italy, and a recent translation of the infamous ""Malleus maleficarum,"" the most important treatise on witch-hunt. We pay close attention to the historical evolution of the so-called witch-craze in Europe through a selection of the best secondary literature on this subject, with special emphasis on Michel de Certeau's ""The Possession at Loudun."" We also study how major Italian and Spanish women mystics, such as Maria Maddalena de' Pazzi and Teresa of Avila, approach the issue of demonic temptation and possession. As far as Renaissance Neoplatonic philosophy is concerned, we read selections from Marsilio Ficino's ""Platonic Theology"" and Girolamo Cardano's mesmerizing autobiography. We also investigate the connection between demonology and melancholy through a close reading of the initial section of Robert Burton's ""Anatomy of Melancholy"" and Cervantes's short story ""The Glass Graduate"" (""El licenciado Vidriera"").",A. Maggi,None,None,Course taught in English. Course not offered in 24-25.,"GNSE 26504, CMLT 27602, HIST 22110, RLST 26501"
187,ITAL 26600,Bruno/Campanella,"This course analyzes the philosophy and theology of Giordano Bruno and Tommaso Campanella, two crucial figures of European sixteenth-century culture. As philosophers, theologians, poets, and narrators, Bruno and Campanella embody the literary, religions, and philosophical syncretism of the Italian Renaissance. To study these authors necessarily entails a close analysis of Florentine Neo-Platonism, Hermetism, magic, and apocalyptism, along with the literary traditions that molded the Italian renaissance. We discuss Bruno's Italian Dialogues, De umbris idearum (his first major treatise on artificial memory), and a selection of his later Latin poems. We then examine Campanella's La Città del sole, most of his philosophical poems, De Antichristo, and a selection of his theological treatises.",A. Maggi,None,None,Classes conducted in English. Texts in English and the original. Course not offered in 24-25.,"RLIT 36600, ITAL 36600"
188,ITAL 26703,Tasso's Jerusalem Delivered,TBD,None,None,None,Course not offered in 24-25.,"REMS 26703, RLIT 36700, ITAL 36703, REMS 36703, FNDL 26705"
189,ITAL 27001,Teatro Italiano Moderno,TBD,None,None,None,None,Course not offered in 24-25.
190,ITAL 27500,Women and the Mafia in Contemporary Italian Cinema,"This course will examine how gender dynamics within mafia contexts have been represented in a selection of Italian films. Students will engage in cinematic analysis by drawing from sociological and psychological studies on female roles in relation to organized crime. Both these fields, sociology and psychology, have underscored the important part that women play in relation to the mafia, notwithstanding the rigid patriarchal structure that allows only male affiliation.
Although focusing primarily on Sicilian mafia, this course will include information on other types of Italian mafia, namely Camorra, 'Ndrangheta and Sacra Corona Unita.
Vocabulary in Italian to identify formal elements of the films will be provided throughout the course.",Veronica Vegna,None,ITAL 20300 or consent of instructor.,Taught in Italian. Course not offered in 24-25.,GNSE 27508
191,ITAL 27600,Beyond Ferrante: Italian Women Writers Rediscovered and the Global Editorial Market,"In this class we read selected works from some of the most influential Italian women writers who are not named Elena Ferrante. Some of these writers contributed to the cultural and literary background that produced Ferrante as well. Others can be seen as Ferrante's peers and even heirs. The remarkable global success of Ferrante's work has created the so-called ""Ferrante effect."" Both in Italy and abroad, editors and scholars are finally paying attention to long overlooked Italian women writers. We will explore this trend of reissues, new publications, and new translations. How has the Ferrante effect recast our assumptions about literary value? Can restorative justice take place within the global editorial market? Is it legitimate to speak about an editorial affirmative action? What is the relationship between Italian periphery and the dominant literary empire? Among the authors we will read are classics--such as Elsa Morante, Natalia Ginzburg, and Anna Maria Ortese--but also new and overlooked voices--such as Fabrizia Ramondino, Fausta Cialente, Paola Masino, Brianna Carafa, Claudia Durastanti, and Veronica Raimo.",Maria Anna Mariani,None,None,Taught in Italian. Course not offered in 24-25.,"GNSE 27606, GLST 27600"
192,ITAL 27700,The (Auto)Biography of a Nation: Francesco De Sanctis and Benedetto Croce,"At its core, this course examines the making and legacy of Francesco De Sanctis's History of Italian Literature (1870-71), a work that distinguished literary critic René Wellek defined as ""the finest history of any literature ever written"" and ""an active instrument of aesthetic evolution."" We will read the History in the larger context of De Sanctis's corpus, including his vast epistolary exchanges, autobiographical writings, and so-called Critical Essays in order to detail his reform of Hegelian aesthetics, his redefinition of the intellectual's task after the perceived exhaustion of the Renaissance, Enlightenment, and Romantic moments, and his campaign against the bent toward erudition, philology, and antiquarianism in 19th-century European scholarship. We will compare De Sanctis's methodology to that of his scholarly models in France (Alphonse de Lamartine, Alfred Mézières) and Germany (Georg Gottfried Gervinus, Georg Voigt) to explore De Sanctis's claim that literary criticisms - not just literary cultures - are ""national."" In the second part of the course, we assess Benedetto Croce's appropriation of De Sanctis in his Aesthetics (1902), arguably the last, vastly influential work in its genre and we conclude with Antonio Gramsci's use of De Sanctis for the regeneration of a literary savvy Marxism or philosophy of praxis.",R. Rubini,None,None,Course not offered in 24-25.,"ITAL 37700, KNOW 27700, CMLT 28800, CMLT 38800, KNOW 37700"
193,ITAL 28400,Pasolini,"This course examines each aspect of Pasolini's artistic production according to the most recent literary and cultural theories, including Gender Studies. We shall analyze his poetry (in particular ""Le Ceneri di Gramsci"" and ""Poesie informa di rosa""), some of his novels (""Ragazzi di vita,"" ""Una vita violenta,"" ""Teorema,"" ""Petrolio""), and his numerous essays on the relationship between standard Italian and dialects, semiotics and cinema, and the role of intellectuals in contemporary Western culture. We shall also discuss the following films: ""Accattone,"" ""La ricotta,"" ""Edipo Re,"" ""Teorema,"" and ""Salo"".",Armando Maggi,None,None,Taught in English. Course not offered in 24-25.,"CMST 23500, GNSE 38600, GNSE 28600, CMST 33500, FNDL 28401, ITAL 38400"
194,ITAL 28424,"Displacing Caravaggio: Art, Media, and Contemporary Visual Culture","Caravaggio is a central figure in the history of Italian art and in the global image of Italy. Caravaggio is also and above all a master of Baroque painting with whom we feel a particular closeness in the name of the themes and modes of his painting. We feel him as our ""contemporary"" or, maybe, thanks to his works, we are the ones who move another time and another space. This course examines the peculiar relevance of Caravaggio in contemporary visual culture. On one side, we explores the ways in which Caravaggio's techniques, themes, and iconography have been appropriated and reinterpreted in modern and contemporary art and media. On the other hand, Caravaggio's painting is observed through an ""anachronistic"" perspective, bringing forth valuable insights for critically reflecting on contemporary media practice and visual culture.",None,Spring,Undergraduates must be in their third or fourth year.,Taught in English.,"ITAL 38424, ARTH 38424, ARTH 28424"
195,ITAL 28500,Petrarch and the Birth of Western Modernity,"This course offers a close reading of the theoretical works of Petrarch (known as the ""father of humanism"" or ""first modern man"") with the aim of pinpointing the literary and rhetorical skills, as well as the self-conscious agenda, that went into the proclamation of a new era in Western history: the ""Renaissance."" How do we at once pay homage to and overcome a time-honored past without severing our ties to history altogether? Is Petrarch's model still viable today in efforts to forge a new beginning? We will pay special attention to Petrarch's fraught relationship with religious and secular models such as Saint Augustine and Cicero, to Petrarch's legacy in notable Renaissance humanists (Pico, Poliziano, Erasmus, Montaigne, etc.), and to the correlation of Petrarchan inquiry with modern concerns and methodologies in textual and social analysis, including German hermeneutics (Gadamer) and critical theory (Gramsci).",Rocco Rubini,None,None,Taught in English. Course not offered in 24-25.,"ITAL 38500, FNDL 28500"
196,ITAL 28702,Italian Comic Theater,"A survey of the history of Italian theater from the Erudite Renaissance Comedy to Goldoni's reform. We will pay particular attention to the tradition of commedia dell'arte (scenarios, stock characters, and plot formation), ancient and medieval influences, evolution and emancipation of female characters, and the question of language. Readings include works by Plautus, Ariosto, Machiavelli, Angelo Beolco (Ruzante), Flaminio Scala, and Goldoni. Toward the end of the course we will consider the legacy of Italian Comedy in relation to the birth of grotesque and realist drama in Pirandello.",R. Rubini,None,None,Taught in English. Course not offered in 24-25.,"ITAL 38702, TAPS 38702, TAPS 28702"
197,ITAL 28705,Literature as Resistance: Reclaiming Italian Margins,"Resistance takes on many forms, some more explicit, some more elusive and covert; the act of writing is one of them. How has writing been used as an act of resistance in the Italian social landscape? How does literature present marginalized individuals with a way to resist cultural and physical oppression, and provide them with a means to promote social and cultural transformation? To answer these and other related questions, this course will explore the formation of counter-hegemonic discourse through the literary production of contemporary writers at the margins of Italian society.",Elizabeth Tavella,None,None,Taught in English. Course not offered in 24-25.,"GNSE 28705, CRES 28705"
198,ITAL 29600,The Worlds of Harlequin: Commedia Dell'arte,"This course is an introduction to the Italian art of theatrical improvisation or commedia dell'arte, a type of theater featuring masked characters and schematic plots. We will look at the influence of Boccaccio's Decameron on the formation of stock-characters, the introduction of women into the realm of theatrical professionalism, the art of costume and mask making, and the Italian knack for pantomime and gestural expression. Readings include such masterpieces in the tradition of comic theater as Machiavelli's The Mandrake and Goldoni's Harlequin Servant of Two Masters, as well as their renditions in film.",Rocco Rubini,None,None,Taught in English. Course not offered in 24-25.,"TAPS 38480, ITAL 39601, TAPS 28480"
199,ITAL 29700,Readings in Special Topics,This course provides directed readings in special topics not covered as part of the program in Italian. Subjects treated and work to be completed for the course must be chosen in consultation with the instructor no later than the end of the preceding quarter.,None,None,"ITAL 10300 or 20300, depending upon the requirements of the program for which credit is sought",None,Students are required to submit the College Reading and Research Course Form.
200,ITAL 29900,BA Paper Preparation: Italian,"In consultation with a faculty member, students must devote the equivalent of a one-quarter course to the preparation of a BA project.",None,None,Consent of undergraduate adviser,None,Students are required to submit the College Reading and Research Course Form. Students seeking honors may count this course towards their course requirements. Must be taken for a quality grade.
201,KREY 12201,Kreyòl for Speakers of Romance Languages I,"This course is intended for speakers of other Romance Languages to quickly develop competence in spoken and written Kreyol (Kreyòl Ayisyen). In this introductory course, students learn ways to apply their skills in another Romance language to master Kreyol by concentrating on the similarities and differences between the two languages. Although familiarity with a Romance language is strongly recommended, students with no prior knowledge of a Romance Languages, and heritage learners, are also welcome.",Gerdine Ulysse,Autumn,None,LACS 12201,None
202,KREY 12301,Kreyòl for Speakers of Romance Languages II,"This course is intended for speakers of other Romance Languages, to quickly develop competence in spoken and written Kreyol (Kreyòl Ayisyen). In this intermediate-level course, students learn ways to apply their skills in another Romance language to master Kreyol by concentrating on the similarities and differences between the two languages. This course offers a rapid review of the basic patterns of the language and expands on the material presented in KREY 12201. Although familiarity with a Romance language is strongly recommended, students with no prior knowledge of a Romance language, and heritage learners, are also welcome.",Gerdine Ulysse,Winter,KREY 12201 or consent of instructor.,LACS 12301,None
203,KREY 20400,Ekspresyon ekri: Kreyòl lakay soti Ayiti rive nan dyaspora a,"This course will provide opportunities to promote deeper knowledge of the Haitian culture while emphasizing the development of writing skills in the Kreyòl language through the use of a variety of authentic texts and cultural experiences. Topics covered in the course will include the Haitian revolution, cuisine, and audio-visual and performing arts. Moreover, students will participate in different cultural exploration outings in the city of Chicago, which will provide additional opportunities to interpret cultural artifacts and reflect on the Haitian culture and its influence on the representation and daily lives of Haitians in the diaspora, particularly in Chicago. In this course, we will: 1) analyze different cultural artifacts in the Haitian cultures through primary and secondary texts, 2) examine the influences of these cultural phenomena on the representation of Haitians and the creation of Haitian identity in the diaspora, and 3) and reflect on the importance of cultural identity in a migration context. Those who will take the course for Kreyòl credits will also develop additional syntactic knowledge in the language through creation of diverse essays. This course will be conducted in two weekly sessions: a common lecture session in English and an additional weekly discussion session in English or Kreyòl.",Gerdine Ulysse,None,"For those seeking credit in Kreyòl, this course is open to students who have taken KREY 12300 (Kreyòl for Speakers of French II), KREY 12301 (Kreyòl for Speakers of Romance Languages II), or instructor consent. Heritage learners are also welcome.",Course not offered in 24-25,"CHST 20400, LACS 20401, RDIN 20410"
204,KREY 21100,"Lang, Sosyete ak Kilti Ayisyèn I","This advanced-level course will focus on speaking and writing skills through the study of a wide variety of contemporary texts and audiovisual materials. It will provide students with a better understanding of contemporary Haitian society. Students will review problematic grammatical structures, write a number of essays, and participate in multiple class debates.",Gerdine Ulysse,Autumn,KREY 12300 or consent of instructor,Taught in Kreyòl.,LACS 21101
205,KREY 21200,"Lang, Sosyete ak Kilti Ayisyèn II","This advanced-level course will focus on speaking and writing skills through a wide variety of texts, audiovisual materials, and cultural experiences. We will study a wide range of Haitian cultural manifestations (e.g., visual arts, music, gastronomy). Students will also review advanced grammatical structures, write a number of essays, participate in multiple class debates, and take cultural trips to have a comprehensive learning experience with Haitian language and culture.",Gerdine Ulysse,Winter,KREY 21100 or consent of instructor.,Taught in Kreyòl.,LACS 21200
206,KREY 21600,"Francophone Caribbean Culture and Society: Art, Music, and Cinema","This course provides an interdisciplinary survey of the contemporary Francophone Caribbean. Students will study a wide range of its cultural manifestations (performing arts like music and dance, literature, cinema, architecture and other visual arts, gastronomy). Attention is also paid to such sociolinguistic issues as the coexistence of French and Kreyòl, and the standardization of Kreyòl.",Gerdine Ulysse,Autumn,None,Taught in English.,"LACS 21600, CRES 21600, FREN 21601, GLST 21600"
207,KREY 29300,Language Identity and Power in French-Creolophone Contexts,"This course examines the concept of language identity (i.e., the language[s] people employ to represent themselves) in multilingual Creolophone communities, particularly in Haiti. This course also examines the relationships between language identity, learning, language use, and literacy development in these societies. By the end of the course, students will be able to explain: 1) what language identity in multilingual Creolophone community reveal about speakers and their language attitudes; 2) how context and mode of communication can impact language identity and language use; 3) literacy acquisition and achievement in Creole communities; and 4) how Creolophones' learning and literacy development are affected by language policies and ideologies. A final project will require students to design and conduct a preliminary sociolinguistic study based on students' interests in the French-Creolophone world.",Gerdine Ulysse,Spring,"Knowledge of French and Kreyòl will be helpful, but not required.",Taught in English.,"FREN 29301, LACS 29299"
208,PORT 10100,Beginning Elementary Portuguese I,"This sequence is intended for beginning and beginning/intermediate students in Portuguese. It provides students with a solid foundation in the basic patterns of spoken and written Portuguese (e.g., grammar, vocabulary, phonetics, sociocultural norms) to develop their speaking, listening, writing, and reading skills. Although the three courses constitute a sequence, there is enough review and recycling at every level for students to enter the sequence whenever it is appropriate for them.
This course is intended for students who have no previous knowledge of Portuguese and for students who need an in-depth review of the basic patterns of the language.",Staff,Autumn,None,None,None
209,PORT 10200,Beginning Elementary Portuguese II,This course is a rapid review of the basic patterns of the language and expands on the material presented in PORT 10100.,Staff,Winter,PORT 10100 or placement,None,None
210,PORT 10300,Beginning Elementary Portuguese III,"This course expands on the material presented in PORT 10200, reviewing and elaborating the basic patterns of the language.",Staff,Spring,PORT 10200 or placement,None,Successful completion of PORT 10300 fulfills the competency requirement
211,PORT 12200,Portuguese For Spanish Speakers,"This course is intended for speakers of Spanish to develop competence quickly in spoken and written Portuguese. In this intermediate-level course, students learn ways to apply their Spanish language skills to mastering Portuguese by concentrating on the similarities and differences between the two languages. Students with a placement of 20100 or higher in any of the other Romance Languages are eligible to take PORT 12200 for completion of the College Language Competency Requirement",Staff,Autumn Spring,SPAN 10300 or consent of instructor.,LACS 12200,None
212,PORT 14100,Portuguese for Speakers of Romance Languages,"This course helps students quickly gain skills in spoken and written Portuguese by building on their prior working knowledge of another Romance language (Spanish, French, Catalan or Italian). By relying on the many similarities with other Romance languages, students can focus on mastering the different aspects of Portuguese, allowing them to develop their abilities for further study. This class covers content from PORT 10100 and 10200.",Staff,Winter,20100 in another Romance language or consent of instructor.,LACS 14100,None
213,PORT 14500,Portuguese for the Professions: Intensive Business Portuguese,"This is an accelerated language course that covers vocabulary and grammar for students interested in working in a business environment where Portuguese is spoken. The focus of this highly interactive class is to develop basic communication skills and cultural awareness through formal classes, readings, discussions, and writings. PORT 14500 satisfies the Language Competency Requirement.",Staff,Spring,"PORT 10200, SPAN 20100, or consent of instructor.",LACS 14500,None
214,PORT 20100,Intermediate Portuguese,This course is a general review and extension of all basic patterns of the language for intermediate students. Students explore selected aspects of Luso-Brazilian tradition through a variety of texts. This course is intented for intermediate students.,Staff,Autumn,"PORT 10300, 12200 or placement",None,None
215,PORT 20200,Advanced Portuguese,"This course helps students develop their descriptive and narrative skills through exposure to written and oral documents (e.g., literary texts, interviews). Students are taught the grammatical and lexical tools necessary to understand these documents, as well as to produce their own analysis and commentaries.",None,None,PORT 20100 or placement,None,Course not offered in 24-25
216,PORT 20500,Cultura do Mundo Lusófono,"In this course students will explore the culture of the Lusophone world through the study of a wide variety of contemporary literary and journalistic texts from Brazil, Portugal, Angola and Mozambique, and unscripted recordings. This advanced language course targets the development of writing skills and oral proficiency in Portuguese. Students will review problematic grammatical structures, write a number of essays, and participate in multiple class debates, using authentic readings and listening segments as linguistic models on which to base their own production.",Staff,Winter,PORT 20100 or consent of the instructor.,LACS 20500,None
