,Course Code,Course Name,Course Description,Instructor(s),Terms Offered,Prerequisite(s),Equivalent Courses,Notes
0,BASQ 12000,Elementary Basque I,"First of the three basic-language sequence in Basque language. It provides students with a solid foundation in the basic patterns of spoken and written Basque (e.g., grammar, vocabulary, sociolinguistic norms) and emphasizes all four skills: speaking, listening, writing, and reading. This course is intended for students with no previous exposure to Basque and for those who need an in-depth review of the patterns of the language.",None,Autumn,None,None,None
1,BASQ 12100,Elementary Basque II,"Second segment of the first-year course sequence in Basque language. It provides students with a solid foundation in the basic patterns of spoken and written Basque (e.g., grammar, vocabulary, sociolinguistic norms) and emphasizes all four skills: speaking, listening, writing, and reading.",None,Winter,BASQ 12000 or consent of instructor.,None,None
2,BASQ 12200,Elementary Basque III,"Third and final segment of the basic-language Basque sequence. It provides students with a solid foundation in the basic patterns of spoken and written Basque (e.g., grammar, vocabulary, sociolinguistic norms) and emphasizes all four skills: speaking, listening, writing, and reading.",None,Spring,BASQ 12100 or consent of instructor.,None,None
3,BASQ 21100,Basque Culture and Society,"Straddling the border of southern France and northern Spain, the Basque Country is the home of a complex national community without a state -but with a language that is unrelated to any other in the world and is perhaps the most remarkable feature of their cultural identity.  Through the analysis of a wide variety of texts and artifacts, this course will give students the the background to navigate through different dimensions of Basque culture (traditions, gastronomy, music, the language) as well as the history that has marked the development of Basque society (including the so-called Basque Conflict).",None,Winter,None,Taught in English. Prior knowledge of Basque language or culture not required.,"SPAN 21101, GLST 21100"
4,BASQ 24700,Introduction to Basque Culture,"Straddling the border of southern France and northern Spain, the land of the Basques has long been home to a people who had no country of their own but have always viewed themselves as a nation. No one has ever been able to find their roots, and their peculiar language is not related to any other in the world, but they have managed to keep their mysterious identity alive, even if many other civilizations tried to blot it out. The aim of this course is to create real situations that will enable the students to learn the meaning of Basque culture. It will be a guided tour throughout Basque history and society. Students will learn about the mysterious origins of the language; they will visit the most beautiful places of the Basque country; they will get to know and appreciate Basque traditions, gastronomy, music . . . and most importantly, they will be able to compare and contrast their own cultures and share their ideas during the lessons, creating an enriching atmosphere full of entertaining activities, such as listening to music, reading legends and tales, watching documentaries, and much more.",None,None,None,This course will be conducted in English. Prior knowledge of Basque language or culture is not required. Course not offered in 24-25.,"SPAN 24701, GLST 24700"
5,BASQ 24710,Spanish Cinema-Basque Cinema,"This course explores Basque cinema from its beginnings to our days while also reviewing Spanish cinema from a Basque point of view. Among other topics, the course will explore the nationalist imaginary and its influence in film, the centrality of gender (and motherly) representations in Basque cinema, Basque films' recent tendency to become Spanish blockbusters outselling Hollywood, and allusions to the Basque Country in Spanish cinema.",None,None,None,Course not offered in 24-25.,"CMLT 23810, SPAN 24716"
6,BASQ 24730,The Revitalization of the Basque Language,"In the last 30 years, the Basque language has seen an increase in the number of speakers, especially among younger groups.  The implementation of several language and cultural policies, along with a transformation in the educational system, has been key to this development. In this course we will explore these revitalizing practices used in the Basque Country by analyzing the sociolinguistic situation of Basque language from the transition to democracy in the late 1970s to the present.",None,Spring,None,Taught in English.,"LING 24730, SPAN 24730"
7,BASQ 29300,El ciclo de cuentos en la ficción ibérica contemporánea,"Short stories are usually read as discrete pieces of writing, valued for their individuality and the completeness of their effect on readers.  However, they are not always presented in complete isolation, but come inserted in collections where the company of other stories may create connections similar to those found in larger works of fiction (to the extent that certain groups of short stories can almost be read like novels).  The collection of stories has a long literary tradition, but in the last century a particular form -the so called short story cycle- has emerged as a way of testing the boundaries of extended narratives.  In this course, and through the study of a number of books representative of the short story cycle in Iberian literatures, we will explore the poetics of fiction (short and long) and the formal and interpretative challenges presented by the genre.",Mario Santana,Course not offered in 24-25.,SPAN 20300 or consent of instructor,Taught in Spanish. Course not offered in 24-25.,"SPAN 39300, CATA 29300, SPAN 29300"
8,BASQ 29700,Readings in Special Topics,This course is a study of advanced language or directed readings in special topics not covered by courses offered as part of the program in Basque. Subjects treated and work completed for the course must be chosen in consultation with the instructor no later than the end of the preceding quarter.,None,None,"BASQ 12200, depending upon the requirements of the program for which credit is sought.",None,Students are required to submit the College Reading and Research Course Form.
9,CATA 12200,Catalan for Speakers of Romance Languages I,"This course is intended for speakers of other Romance languages to quickly develop competence in spoken and written Catalan. In this introductory course, students learn ways to apply their skills in another Romance language to mastering Catalan by concentrating on the similarities and differences between the two languages. Students with a placement of 20100 or higher in any of the other Romance Languages are eligible to take CATA 12200 for completion of the College Language Competency Requirement.",Staff,Autumn Spring,"Although familiarity with a Romance language is strongly recommended, students with no prior knowledge of a Romance language are also welcome.",None,None
10,CATA 12300,Catalan for Speakers of Romance Languages II,"This course is intended for speakers of other Romance languages to quickly develop competence in spoken and written Catalan. In this intermediate-level course, students learn ways to apply their skills in another Romance language to mastering Catalan by concentrating on the similarities and differences between the two languages. This course offers a rapid review of the basic patterns of the language and expands on the material presented in CATA 12200.",Staff,Winter,CATA 12200 or consent of instructor.,None,None
11,CATA 21100,"Llengua, societat i cultura I","This advanced-level course will focus on speaking and writing skills through the study of a wide variety of contemporary texts and audiovisual materials. It will provide students with a better understanding of contemporary Catalan society. Students will review problematic grammatical structures, write a number of essays, and participate in multiple class debates. This course satisfies language competency.",Staff,None,"CATA 11200, CATA 12300 or consent of instructor",None,Course not offered in 24-25
12,CATA 21200,"Llengua, societat i cultura II","This advanced-level course will focus on speaking and writing skills through a wide variety of texts and audiovisual materials. We will study a wide range of Catalan cultural manifestations (e.g., visual arts, music, gastronomy). Students will also review advanced grammatical structures, write a number of essays, and participate in multiple class debates. This course satisfies language competency.",Staff,Spring,CATA 21100 or consent of instructor,None,None
13,CATA 23333,Reading Catalan for Research Purposes,"This fast-paced course prepares students to read and do research using texts in Catalan. Students will work on grammar, vocabulary and reading skills, and they will also get introduced to some translation strategies. Part of the texts students will work on will be academic texts in their respective areas of research. This course may fulfill the graduate language requirement in some departments.",None,None,None,None,None
14,CATA 21500,Introduction to Contemporary Catalonia,"This course provides an interdisciplinary survey of contemporary Catalonia. We study a wide range of its cultural manifestations (architecture, paintings, music, arts of the body, literature, the folkloric calendar, cinema, gastronomy) as well as its current political situation and the role that emigration and immigration play in the constitution of the Catalan identity. Attention is also paid to some sociolinguistic issues, such as the coexistence of Catalan and Spanish, and the standarization of Catalan. A couple of sessions will be devoted to acquiring a ""survival Catalan.""",Staff,None,None,None,Course not offered in 24-25
15,CATA 21600,"Catalan Culture and Society: Art, Music, and Cinema","This course provides an interdisciplinary survey of contemporary Catalonia. We study a wide range of its cultural manifestations (architecture, paintings, music, arts of the body, literature, cinema, gastronomy). Attention is also paid to some sociolinguistic issues, such as the coexistence of Catalan and Spanish, and the standardization of Catalan.",Bel Olid,Spring,None,The course will be conducted in English.,"GLST 21601, SPAN 21610"
16,CATA 21950,"Dark Stairways of Desire"": Lusting beyond the Norm in Contemporary Catalan Literature","Although we can find a significant number of authors exploring queer desire and identities throughout the history of Catalan Literature (from lesbian scenes in Joanot Martorell's ""Tirant lo blanc"" to expanding gender identities in Maria Aurèlia Capmany's ""Quim/Quima""), more recent Catalan Literature is blooming with queerness and non-normative lust. This course will give an overview of contemporary Catalan works influenced by feminist and queer debates from the seventies on. Beginning with renowned poet Maria Mercè Marçal's only novel, ""The Passion According to Rennée Vivien,"" winner of several of the most prestigious literary awards for Catalan Literature, we will go on to discover 21st-century works by Eva Baltasar and Anna Punsoda. We will also read poems, short stories and excerpts from authors such as Maria Sevilla, Mireia Calafell, Raquel Santanera, Sebastià Portell, Sil Bel and Ian Bermúdez, among others.",Bel Olid,Winter,None,Taught in English.,"GNSE 23150, SPAN 21950, GLST 21950"
17,CATA 22350,Speaking Truth to Power in Medieval Iberia,"In the multilingual and multireligious environment of the Iberian middle ages, poetry can express many things. And while literary history has granted a prestigious space to some of these things, such as love or spirituality, it has consistently neglected others, such as socio-political satire or vulgarity. This class will be paying attention to that other less talked-about poetry that gets into the political struggles of the period, that talks in profanities about profane things. In other words, the poetry that does not speak to the eternity of existence, but that gets its hands dirty with earthly matters. The poetry that savagely mocks and cuts through social conventions in a way that makes seem contemporary Twitter trolls benevolent in comparison. For this class we will be reading authors who wrote in Galician-Portuguese such as Joao Soares de Paiva or King Alfonso X, authors who wrote in Catalan such as Guillem de Bergueda or Ramon Vidal de Besalu, and authors who wrote in Spanish such as Juan Ruiz or Juan de Mena. Translations to Spanish will be provided or worked though class discussion.",N. Blanco Mourelle,None,None,Course not offered in 24-25,"MDVL 22350, SPAN 22350, CATA 32350, PORT 22350, PORT 32350, SPAN 32350"
18,CATA 23500,Alone in the Mountains: Tales of Freedom and Violence in Contemporary Catalan Literature,"From witches to ""goges"" (""water women""), Catalan folklore shows a tradition of women living on their own in the mountains, liberated from societal conventions. These women are portrayed as fascinating yet threatening figures. This ancient imagery has permeated contemporary literature, manifested in novels that depict women who remove themselves from ""civilization"" to inhabit rural areas of Catalunya, seeking freedom and having to confront at the same time societal norms, abusive partners or even their own personal demons. The mountains, far from ideal and peaceful, are an untamed and often brutal space in which human lives hold no greater value than those of goats, mushrooms, rivers. 
In this course we shall engage with four novels authored by women: ""Solitude (1904) by Victor Català, ""Stone in a Landslide"" (1984) by Maria Barbal, ""When I Sing Mountains Dance"" (2019) by Irene Solà, and ""Alone"" (2021) by Carlota Gurt. Through the analysis of these literary works, we aim to delve into Catalan culture and explore its literary archetypes, while establishing significant connections among these texts and their place in modern and contemporary literature.",Bel Olid,Autumn,None,"Taught in English, but students seeking credit for the HLBS major/minor must do part of the readings and written work in Catalan or Spanish as necessary for their degree.","GNSE 23157, GLST 23500, SPAN 23501"
19,CATA 25605,Inquisiciones,"The Inquisition was, if not the most important juridical and religious institution of premodern Iberia, certainly the most emblematic. In truth, there was not one Inquisition, but many. Without them, terms such as heresy, conversion, or auto-da-fé would not have the currency they do today. These terms are best understood as tools for the disciplining of religious communities and the controlling of the circulation of ideas. This is a class designed to help students understand the Inquisition as a complex historical phenomenon that left a rich archive where anthropological research and theological debate were made to coexist.",Noel Blanco Mourelle,Course not offered in 24-25.,None,Taught in Spanish.,"SPAN 25605, SPAN 35605, CATA 35605"
20,CATA 26525,Literatura política en el Siglo de Oro,TBD,Laia Miralles,Spring,None,"SPAN 36525, CATA 36525, SPAN 26525",None
21,CATA 26555,Self-determination and Democracy in Spain: The Case of Catalonia,"In recent years, tensions between Spain and Catalonia have called attention to a number of long-standing issues that have remained unresolved in modern Spanish cultural and political history: the recognition of national or regional identities, the rights of minority cultures and languages, the nature of democracy and citizenship… This course will study the history of Spanish and Catalan nation-building, as well as the ideological and cultural discourses generated around those projects, and it will pay particular attention to current debates regarding Catalonia's claim to self-determination.",M. Santana,Course not offered in 24-25.,None,"SPAN 36555, CATA 36555, SPAN 26555",None
22,CATA 28024,"Ficción del siglo XX, tradición y canon: la narrativa en catalán","El curso ofrece una introducción al concepto de 'tradición' y a sus mecanismos de funcionamiento, y analiza su relación con la creación literaria contemporánea a partir del estudio de tres obras fundamentales de la narrativa catalana del siglo XX: ""El quadern gris"" de Pla, ""Mirall trencat"" de Mercè Rodoreda y ""Estremida memòria"" de Jesús Moncada. Estas obras de géneros distintos -diario y relato- serán puestas en relación con la ficción contemporánea universal: leeremos los textos de Pla a la luz de la tradición diarista contemporánea, de Woolf o Nin a Walser, Pavese, Gombrowicz, Torga, Ribeyro o Piglia; la novela de Rodoreda, desde el conocimiento de las técnicas experimentales del modernism; y la de Moncada, a través de los universos ficcionales de Faulkner, Bassani, Carpentier, o García Márquez, y de la novela clásica de aventuras de Dumas y Verne. El propósito es contribuir no sólo a clarificar un concepto esencial en las humanidades, como es el de 'tradición', sino a situar en el contexto literario de la ficción internacional tres autores de lengua catalana que han devenido clásicos por su éxito comercial y académico, por el elevado número de traducciones que han merecido, y por su ascendiente en autores posteriores. Estudiaremos el proceso creativo de la ficción contemporánea y sus lazos con la tradición a través de un enfoque comparatista que tiene en cuenta cuestiones como la tensión entre literaturas de lenguas minoritarias y literaturas dominantes.",Javier Aparicio Maydeu,None,None,Taught in Spanish. Course not offered in 24-25.,"SPAN 28024, CATA 38024, CMLT 38024, CMLT 28024, SPAN 38024"
23,CATA 28620,"Fiction, Memory, History: Jaume Cabré's Jo confesso","A detailed reading, analysis, and discussion of Jaume Cabré's Jo confesso (Confessions, 2011), a monumental work of contemporary Catalan literature. We will explore the literary strategies and techniques at play in the novel, as well as its take on the relation between fiction and history, and the representation of memory and loss.",None,Course not offered in 24-25.,None,Course not offered in 24-25,"CATA 38620, SPAN 38620, SPAN 28620"
24,CATA 29300,El ciclo de cuentos en la ficción ibérica contemporánea,"Short stories are usually read as discrete pieces of writing, valued for their individuality and the completeness of their effect on readers.  However, they are not always presented in complete isolation, but come inserted in collections where the company of other stories may create connections similar to those found in larger works of fiction (to the extent that certain groups of short stories can almost be read like novels).  The collection of stories has a long literary tradition, but in the last century a particular form -the so called short story cycle- has emerged as a way of testing the boundaries of extended narratives.  In this course, and through the study of a number of books representative of the short story cycle in Iberian literatures, we will explore the poetics of fiction (short and long) and the formal and interpretative challenges presented by the genre.",Mario Santana,Course not offered in 24-25.,SPAN 20300 or consent of instructor,Taught in Spanish. Course not offered in 24-25.,"BASQ 29300, SPAN 39300, SPAN 29300"
25,CATA 29700,Readings in Special Topics,This course involves directed readings in special topics not covered by courses offered as part of the program in Catalan. Subjects treated and work to be completed for this course must be chosen in consultation with the instructor no later than the end of the preceding quarter.,None,None,"CATA 10300 or 20200, depending upon the requirements of the program for which credit is sought",None,Students are required to submit the College Reading and Research Course Form.
26,CATA 29900,BA Paper Preparation: Catalan,"In consultation with a faculty member, students must devote the equivalent of a one-quarter course to the preparation of a BA project.",None,None,Consent of undergraduate adviser,None,Students are required to submit the College Reading and Research Course Form. Students seeking honors may count this course towards their course requirements. Must be taken for a quality grade.
27,FREN 10100,Beginning Elementary French I,"This course-intended for students who have no previous knowledge of French and for those who need an in-depth review of the very basic patterns of the language-is the first in a three-part language sequence that provides beginning students with a solid foundation in the linguistic and sociocultural norms necessary for everyday communication in the French-speaking world. Our unique method guides students to learn French inductively, through authentic discourse, so that they learn to speak more like native speakers from the very beginning. This course is designed to help students achieve functional competency in speaking, writing, listening, and reading, with a focus on present tense constructions, and to engage students in all three modes of communication (interpersonal, interpretive, and presentational). Exposure to French and Francophone materials will foster cultural awareness and encourage intercultural reflection.",Staff,Autumn Spring Winter,None,None,None
28,FREN 10200,Beginning Elementary French II,"This course-the second in a three-part language sequence that provides beginning students with a solid foundation in the linguistic and sociocultural norms necessary for everyday communication in the French-speaking world-offers a rapid review of the basic patterns of the language, and expands on the material presented in FREN 10100. This course is designed to help students achieve functional competency in speaking, writing, listening, and reading, with a focus on present and past time frames, and to engage students in all three modes of communication (interpersonal, interpretive, and presentational). Students further explore French and Francophone materials that foster cultural awareness and encourage intercultural reflection.",Staff,Autumn Spring Winter,FREN 10100 or placement.,None,None
29,FREN 10300,Beginning Elementary French III,"This course-the last in a three-part sequence that provides beginning students with a solid foundation in the linguistic and sociocultural norms necessary for everyday communication in the French-speaking world-expands on the material presented in FREN 10200, reviewing and elaborating the basic patterns of the language with the aim of developing functional competency in all four skills (speaking, writing, listening, and reading) in most time frames. Students continue to engage in all three modes of communication (interpersonal, interpretive, and presentational), and to explore French and Francophone materials that foster cultural awareness and encourage intercultural reflection. Successful completion of FREN 10300 meets the College's language competence requirement.",Staff,Autumn Spring Winter,FREN 10200 or placement.,None,None
30,FREN 10402,Heritage French : Developing Foundational Skills,"This course is designed to build on heritage learners' skills to prepare them for success in subsequent French courses. Skill areas include in-depth practice in reading and writing, along with review and expansion of targeted grammar structures, and development of precision in vocabulary.",None,Autumn,None,None,"This course satisfies the College Language Competency Requirement. Designed for heritage learners who placed into FREN 10200 or 10300, or who have not studied French formally. Can also be added with instructor consent. No auditors permitted. If course is full, or total enrollment is less than enrollment limit & you can't register, attend on 1st day. Registered students who don't attend on 1st day may lose spot."
31,FREN 12001,Intensive French I,"Intensive French I, II and III: This intensive, three-quarter sequence brings students with no prior background in French to advanced-low levels in all four skills-reading, writing, speaking, and listening-thus preparing students to take third-year level courses in French. Learners who are starting French late in their College careers or who wish to move forward swiftly will gain skills corresponding to two full years of study by completing the entire sequence. Although the three classes constitute a sequence, students may enter the sequence whenever it is appropriate for them based on prior courses or placement exam results. Students may also exit the sequence after any given class and continue in the appropriate course in the Elementary or Intermediate French track. NOTE: Each course is 200 units and corresponds in workload to taking two courses. FREN 12001, the first course in the sequence, covers the equivalent of FREN 10100 and 10200.",Staff,Autumn,"For students with no prior French, or placement in FREN 10100.",None,Course is 200 units and corresponds in workload to taking two courses.
